{
  "schema_version": 1,
  "id": "contract-test-portable",
  "harness": {
    "name": "contract-test",
    "version": "1"
  },
  "model": {
    "provider": "none",
    "id": "none",
    "realization": "local-artifact",
    "artifact_ref": null,
    "foundry_ref": null
  },
  "execution_environment": {
    "venue": "portable-contract-fixture",
    "inference_route": "fixture:none"
  },
  "toolset": [
    "read_file",
    "write_file"
  ],
  "configuration": {
    "fixture": "deterministic-portability-v1"
  },
  "authority_profile": "task-scoped-workcell"
}
