{
  "schema_version": 1,
  "id": "goose-prebuilt-qwen3-coder-30b-local-ollama",
  "harness": {
    "name": "goose",
    "version": "1.55.0",
    "artifact_ref": "ghcr.io/sempersupra/model-spelunker-harness-goose@sha256:1abe2926b302929a909d410747b6ae60fa7856d0ec9adf8977469763b0d982d9",
    "admission_ref": "github:SemperSupra/model-spelunker#147:qualification/harness-artifacts/goose-1.55.0-linux-x64-glibc236.admission.json",
    "realization": {
      "profile_ref": "qualification/harness-realizations/goose-linux-amd64-glibc236-v1.json",
      "profile_digest": "sha256:759cae9ff24cc0d525476989de3d70d51ac7deb947b122493dc81f269d5f2062"
    }
  },
  "model": {
    "provider": "ollama",
    "id": "qwen3-coder:30b",
    "realization": "local-artifact",
    "artifact_ref": "ollama-sha256:06c1097efce0431c2045fe7b2e5108366e43bee1b4603a7aded8f21689e90bca",
    "foundry_ref": null
  },
  "execution_environment": {
    "venue": "local-workstation/linux-x64",
    "inference_route": "local:ollama-openai-v1",
    "substrate_profile": "local-linux-x64-gpu"
  },
  "toolset": [
    "developer"
  ],
  "configuration": {
    "source_revision": "2bcb8583a18a0623eb78c9ed845d597ed99fae48",
    "build_profile": "no-default-features+rustls-tls",
    "build_artifact_digest": "sha256:10c1cd810d30aadb672d017a9563d375020466b0a752682a4afd0217b671ba43",
    "context": 32768,
    "thinking_effort": "off",
    "max_turns": 4,
    "max_tool_repetitions": 2,
    "harness_delivery": "prebuilt-admitted-artifact"
  },
  "authority_profile": "task-scoped-workcell"
}
