{
  "schema_version": 1,
  "id": "openworker-qwen3-1.7b-gha-ollama",
  "harness": {
    "name": "openworker",
    "version": "5bc10d928e0b64aae74313349a3b17bd19643ae2"
  },
  "model": {
    "provider": "ollama",
    "id": "qwen3:1.7b",
    "realization": "local-artifact",
    "artifact_ref": "ollama-sha256:8f68893c685c3ddff2aa3fffce2aa60a30bb2da65ca488b61fff134a4d1730e7",
    "foundry_ref": null
  },
  "execution_environment": {
    "venue": "github-hosted-actions/ubuntu-24.04-x64",
    "inference_route": "local:ollama-0.34.1",
    "substrate_profile": "gha-linux-x64-openworker-ollama"
  },
  "toolset": [
    "read_file",
    "write_file"
  ],
  "configuration": {
    "context": 32768,
    "reasoning_effort": "none",
    "max_iterations": 4
  },
  "authority_profile": "task-scoped-workcell"
}
